{
  "feature_version": "v2",
  "window_start": "2026-03-24T10:00:00Z",
  "window_end": "2026-03-24T10:01:00Z",
  "entity": {
    "ip": "1.2.3.4",
    "session_id": "sess-bot-001",
    "user_agent": "Googlebot/2.1"
  },
  "features": {
    "number_of_requests": 42,
    "total_duration_s": 58,
    "average_time_ms": 120,
    "repeated_requests": 0.83,
    "http_response_2xx": 0.76,
    "http_response_3xx": 0.02,
    "http_response_4xx": 0.18,
    "http_response_5xx": 0.04,
    "get_method": 0.91,
    "post_method": 0.07,
    "head_method": 0.01,
    "other_method": 0.01,
    "night": 0,
    "max_barrage": 12
  }
}
